{
  "$id": "urn:world-studio:schema:world_studio.reconstruction_job.v0.1",
  "$schema": "https://json-schema.org/draft/2020-12/schema",
  "additionalProperties": false,
  "properties": {
    "attempt": {
      "maximum": 9007199254740991,
      "minimum": 1,
      "type": "integer"
    },
    "authority": {
      "const": "proposal_only"
    },
    "budget": {
      "additionalProperties": false,
      "properties": {
        "log_bytes": {
          "$ref": "#/$defs/positiveSafeInteger"
        },
        "max_output_artifacts": {
          "maximum": 1024,
          "minimum": 1,
          "type": "integer"
        },
        "memory_bytes": {
          "$ref": "#/$defs/positiveSafeInteger"
        },
        "output_bytes": {
          "$ref": "#/$defs/positiveSafeInteger"
        },
        "wall_time_ms": {
          "maximum": 86400000,
          "minimum": 1,
          "type": "integer"
        }
      },
      "required": [
        "wall_time_ms",
        "memory_bytes",
        "output_bytes",
        "log_bytes",
        "max_output_artifacts"
      ],
      "type": "object"
    },
    "created_at": {
      "$ref": "#/$defs/timestamp"
    },
    "inputs": {
      "items": {
        "$ref": "#/$defs/roleArtifactReference"
      },
      "maxItems": 65536,
      "minItems": 1,
      "type": "array"
    },
    "job_id": {
      "$ref": "#/$defs/identifier"
    },
    "job_kind": {
      "$ref": "#/$defs/identifier"
    },
    "loaded_world_effect": {
      "const": "none"
    },
    "requested_outputs": {
      "items": {
        "$ref": "#/$defs/identifier"
      },
      "maxItems": 64,
      "minItems": 1,
      "type": "array",
      "uniqueItems": true
    },
    "schema": {
      "const": "world_studio.reconstruction_job.v0.1"
    },
    "source": {
      "additionalProperties": false,
      "properties": {
        "final_sequence_id": {
          "anyOf": [
            {
              "maximum": 9007199254740991,
              "minimum": 1,
              "type": "integer"
            },
            {
              "type": "null"
            }
          ]
        },
        "live_session_schema": {
          "enum": [
            "capture_splat.live_session.v0.1",
            "capture_splat.live_session.v0.2"
          ]
        },
        "session_id": {
          "$ref": "#/$defs/identifier"
        }
      },
      "required": [
        "session_id",
        "live_session_schema",
        "final_sequence_id"
      ],
      "type": "object"
    },
    "worker": {
      "additionalProperties": false,
      "properties": {
        "capability_sha256": {
          "$ref": "#/$defs/sha256"
        },
        "worker_id": {
          "$ref": "#/$defs/identifier"
        }
      },
      "required": [
        "worker_id",
        "capability_sha256"
      ],
      "type": "object"
    }
  },
  "required": [
    "schema",
    "job_id",
    "attempt",
    "created_at",
    "source",
    "worker",
    "job_kind",
    "inputs",
    "requested_outputs",
    "budget",
    "authority",
    "loaded_world_effect"
  ],
  "title": "World Studio reconstruction job v0.1",
  "type": "object",
  "$defs": {
    "identifier": {
      "maxLength": 128,
      "pattern": "^[A-Za-z0-9][A-Za-z0-9._-]{0,127}$",
      "type": "string"
    },
    "mediaType": {
      "pattern": "^[a-z0-9][a-z0-9!#$&^_.+-]*/[a-z0-9][a-z0-9!#$&^_.+-]*$",
      "type": "string"
    },
    "positiveSafeInteger": {
      "maximum": 9007199254740991,
      "minimum": 1,
      "type": "integer"
    },
    "roleArtifactReference": {
      "additionalProperties": false,
      "properties": {
        "media_type": {
          "$ref": "#/$defs/mediaType"
        },
        "path": {
          "$ref": "#/$defs/safeRelativePath"
        },
        "role": {
          "$ref": "#/$defs/identifier"
        },
        "sha256": {
          "$ref": "#/$defs/sha256"
        },
        "size_bytes": {
          "$ref": "#/$defs/positiveSafeInteger"
        }
      },
      "required": [
        "role",
        "path",
        "sha256",
        "size_bytes",
        "media_type"
      ],
      "type": "object"
    },
    "safeRelativePath": {
      "maxLength": 1024,
      "minLength": 1,
      "not": {
        "anyOf": [
          {
            "pattern": "^/"
          },
          {
            "pattern": "\\\\"
          },
          {
            "pattern": "//|/$"
          },
          {
            "pattern": "^[A-Za-z][A-Za-z0-9+.-]*:"
          },
          {
            "pattern": "(^|/)\\.\\.?(/|$)"
          }
        ]
      },
      "pattern": "^[^\\u0000]+$",
      "type": "string"
    },
    "sha256": {
      "pattern": "^sha256:[0-9a-f]{64}$",
      "type": "string"
    },
    "timestamp": {
      "pattern": "^[1-9][0-9]{3}-[0-9]{2}-[0-9]{2}T[0-9]{2}:[0-9]{2}:[0-9]{2}(?:\\.[0-9]{3})?Z$",
      "type": "string"
    }
  }
}
