{
  "attempt": 1,
  "authority": "proposal_only",
  "budget": {
    "log_bytes": 65536,
    "max_output_artifacts": 4,
    "memory_bytes": 268435456,
    "output_bytes": 16777216,
    "wall_time_ms": 30000
  },
  "created_at": "2026-08-09T10:01:00.000Z",
  "inputs": [
    {
      "media_type": "application/json",
      "path": "inputs/capture-splat.world-studio.json",
      "role": "capture-handoff",
      "sha256": "sha256:3333333333333333333333333333333333333333333333333333333333333333",
      "size_bytes": 4096
    }
  ],
  "job_id": "worker-job-0001",
  "job_kind": "fixture-proposal",
  "loaded_world_effect": "none",
  "requested_outputs": [
    "preview-manifest"
  ],
  "schema": "world_studio.reconstruction_job.v0.1",
  "source": {
    "final_sequence_id": 2,
    "live_session_schema": "capture_splat.live_session.v0.1",
    "session_id": "fixture-session-01"
  },
  "worker": {
    "capability_sha256": "sha256:032a657bf3d39e5194d13401f5b7f215bf1b12804bff9786a6816db6313a466b",
    "worker_id": "fixture-reconstruction-worker"
  }
}
